Series_Title,Released_Year,Genre,IMDB_Rating,Overview,Meta_score,Director,Star1,Star2,Star3,soup
detachment,2011,Drama,7.7,a substitute teacher who drifts from classroom to classroom finds a connection to the students and teachers during his latest assignment,52.0,tonykaye,adrienbrody,christinahendricks,marciagayharden,detachment drama tonykaye adrienbrody christinahendricks marciagayharden a substitute teacher who drifts from classroom to classroom finds a connection to the students and teachers during his latest assignment
midnight in paris,2011,"Comedy, Fantasy, Romance",7.7,while on a trip to paris with his fiancée's family a nostalgic screenwriter finds himself mysteriously going back to the 1920s every day at midnight,81.0,woodyallen,owenwilson,rachelmcadams,kathybates,midnight in paris comedy fantasy romance woodyallen owenwilson rachelmcadams kathybates while on a trip to paris with his fiancée's family a nostalgic screenwriter finds himself mysteriously going back to the 1920s every day at midnight
the lego movie,2014,"Animation, Action, Adventure",7.7,"an ordinary lego construction worker thought to be the prophesied as ""special"" is recruited to join a quest to stop an evil tyrant from gluing the lego universe into eternal stasis",83.0,christophermiller,phillord,chrispratt,willferrell,"the lego movie animation action adventure christophermiller phillord chrispratt willferrell an ordinary lego construction worker thought to be the prophesied as ""special"" is recruited to join a quest to stop an evil tyrant from gluing the lego universe into eternal stasis"
gravity,2013,"Drama, Sci-Fi, Thriller",7.7,two astronauts work together to survive after an accident leaves them stranded in space,96.0,alfonsocuarón,sandrabullock,georgeclooney,edharris,gravity drama sci-fi thriller alfonsocuarón sandrabullock georgeclooney edharris two astronauts work together to survive after an accident leaves them stranded in space
star trek into darkness,2013,"Action, Adventure, Sci-Fi",7.7,after the crew of the enterprise find an unstoppable force of terror from within their own organization captain kirk leads a manhunt to a war-zone world to capture a one-man weapon of mass destruction,72.0,jjabrams,chrispine,zacharyquinto,zoesaldana,star trek into darkness action adventure sci-fi jjabrams chrispine zacharyquinto zoesaldana after the crew of the enterprise find an unstoppable force of terror from within their own organization captain kirk leads a manhunt to a war-zone world to capture a one-man weapon of mass destruction
beasts of no nation,2015,"Drama, War",7.7,a drama based on the experiences of agu a child soldier fighting in the civil war of an unnamed african country,79.0,caryjojifukunaga,abrahamattah,emmanuelaffadzi,rickyadelayitor,beasts of no nation drama war caryjojifukunaga abrahamattah emmanuelaffadzi rickyadelayitor a drama based on the experiences of agu a child soldier fighting in the civil war of an unnamed african country
the social network,2010,"Biography, Drama",7.7,as harvard student mark zuckerberg creates the social networking site that would become known as facebook he is sued by the twins who claimed he stole their idea and by the co-founder who was later squeezed out of the business,95.0,davidfincher,jesseeisenberg,andrewgarfield,justintimberlake,the social network biography drama davidfincher jesseeisenberg andrewgarfield justintimberlake as harvard student mark zuckerberg creates the social networking site that would become known as facebook he is sued by the twins who claimed he stole their idea and by the co-founder who was later squeezed out of the business
x: first class,2011,"Action, Adventure, Sci-Fi",7.7,in the 1960s superpowered humans charles xavier and erik lensherr work together to find others like them but erik's vengeful pursuit of an ambitious mutant who ruined his life causes a schism to divide them,65.0,matthewvaughn,jamesmcavoy,michaelfassbender,jenniferlawrence,x: first class action adventure sci-fi matthewvaughn jamesmcavoy michaelfassbender jenniferlawrence in the 1960s superpowered humans charles xavier and erik lensherr work together to find others like them but erik's vengeful pursuit of an ambitious mutant who ruined his life causes a schism to divide them
the hangover,2009,Comedy,7.7,three buddies wake up from a bachelor party in las vegas with no memory of the previous night and the bachelor missing they make their way around the city in order to find their friend before his wedding,73.0,toddphillips,zachgalifianakis,bradleycooper,justinbartha,the hangover comedy toddphillips zachgalifianakis bradleycooper justinbartha three buddies wake up from a bachelor party in las vegas with no memory of the previous night and the bachelor missing they make their way around the city in order to find their friend before his wedding
skyfall,2012,"Action, Adventure, Thriller",7.7,james bond's loyalty to m is tested when her past comes back to haunt her when mi6 comes under attack 007 must track down and destroy the threat no matter how personal the cost,81.0,sammendes,danielcraig,javierbardem,naomieharris,skyfall action adventure thriller sammendes danielcraig javierbardem naomieharris james bond's loyalty to m is tested when her past comes back to haunt her when mi6 comes under attack 007 must track down and destroy the threat no matter how personal the cost
silver linings playbook,2012,"Comedy, Drama, Romance",7.7,after a stint in a mental institution former teacher pat solitano moves back in with his parents and tries to reconcile with his ex-wife things get more challenging when pat meets tiffany a mysterious girl with problems of her own,81.0,davidorussell,bradleycooper,jenniferlawrence,robertdeniro,silver linings playbook comedy drama romance davidorussell bradleycooper jenniferlawrence robertdeniro after a stint in a mental institution former teacher pat solitano moves back in with his parents and tries to reconcile with his ex-wife things get more challenging when pat meets tiffany a mysterious girl with problems of her own
argo,2012,"Biography, Drama, Thriller",7.7,acting under the cover of a hollywood producer scouting a location for a science fiction film a cia agent launches a dangerous operation to rescue six americans in tehran during the us hostage crisis in iran in 1979,86.0,benaffleck,benaffleck,bryancranston,johngoodman,argo biography drama thriller benaffleck benaffleck bryancranston johngoodman acting under the cover of a hollywood producer scouting a location for a science fiction film a cia agent launches a dangerous operation to rescue six americans in tehran during the us hostage crisis in iran in 1979
(500) days of summer,2009,"Comedy, Drama, Romance",7.7,an offbeat romantic comedy about a woman who doesn't believe true love exists and the young man who falls for her,76.0,marcwebb,zooeydeschanel,josephgordon-levitt,geoffreyarend,(500) days of summer comedy drama romance marcwebb zooeydeschanel josephgordon-levitt geoffreyarend an offbeat romantic comedy about a woman who doesn't believe true love exists and the young man who falls for her
harry potter and the deathly hallows: part 1,2010,"Adventure, Family, Fantasy",7.7,as harry ron and hermione race against time and evil to destroy the horcruxes they uncover the existence of the three most powerful objects in the wizarding world: the deathly hallows,65.0,davidyates,danielradcliffe,emmawatson,rupertgrint,harry potter and the deathly hallows: part 1 adventure family fantasy davidyates danielradcliffe emmawatson rupertgrint as harry ron and hermione race against time and evil to destroy the horcruxes they uncover the existence of the three most powerful objects in the wizarding world: the deathly hallows
gake no ue no ponyo,2008,"Animation, Adventure, Comedy",7.7,a five-year-old boy develops a relationship with ponyo a young goldfish princess who longs to become a human after falling in love with him,86.0,hayaomiyazaki,cateblanchett,mattdamon,liamneeson,gake no ue no ponyo animation adventure comedy hayaomiyazaki cateblanchett mattdamon liamneeson a five-year-old boy develops a relationship with ponyo a young goldfish princess who longs to become a human after falling in love with him
frost/nixon,2008,"Biography, Drama, History",7.7,a dramatic retelling of the post-watergate television interviews between british talk-show host david frost and former president richard nixon,80.0,ronhoward,franklangella,michaelsheen,kevinbacon,frost/nixon biography drama history ronhoward franklangella michaelsheen kevinbacon a dramatic retelling of the post-watergate television interviews between british talk-show host david frost and former president richard nixon
papurika,2006,"Animation, Drama, Fantasy",7.7,when a machine that allows therapists to enter their patients' dreams is stolen all hell breaks loose only a young female therapist paprika can stop it,81.0,satoshikon,megumihayashibara,tôruemori,katsunosukehori,papurika animation drama fantasy satoshikon megumihayashibara tôruemori katsunosukehori when a machine that allows therapists to enter their patients' dreams is stolen all hell breaks loose only a young female therapist paprika can stop it
changeling,2008,"Biography, Crime, Drama",7.7,grief-stricken mother christine collins (angelina jolie) takes on the lapd to her own detriment when it tries to pass off an obvious impostor as her missing child,63.0,clinteastwood,angelinajolie,colmfeore,amyryan,changeling biography crime drama clinteastwood angelinajolie colmfeore amyryan grief-stricken mother christine collins (angelina jolie) takes on the lapd to her own detriment when it tries to pass off an obvious impostor as her missing child
flipped,2010,"Comedy, Drama, Romance",7.7,two eighth-graders start to have feelings for each other despite being total opposites,45.0,robreiner,madelinecarroll,callanmcauliffe,rebeccademornay,flipped comedy drama romance robreiner madelinecarroll callanmcauliffe rebeccademornay two eighth-graders start to have feelings for each other despite being total opposites
toki o kakeru shôjo,2006,"Animation, Adventure, Comedy",7.7,a high-school girl named makoto acquires the power to travel back in time and decides to use it for her own personal benefits little does she know that she is affecting the lives of others just as much as she is her own,78.0,mamoruhosoda,riisanaka,takuyaishida,mitsutakaitakura,toki o kakeru shôjo animation adventure comedy mamoruhosoda riisanaka takuyaishida mitsutakaitakura a high-school girl named makoto acquires the power to travel back in time and decides to use it for her own personal benefits little does she know that she is affecting the lives of others just as much as she is her own
death note: desu nôto,2006,"Crime, Drama, Fantasy",7.7,a battle between the world's two greatest minds begins when light yagami finds the death note a notebook with the power to kill and decides to rid the world of criminals,78.0,shûsukekaneko,tatsuyafujiwara,ken'ichimatsuyama,asakaseto,death note: desu nôto crime drama fantasy shûsukekaneko tatsuyafujiwara ken'ichimatsuyama asakaseto a battle between the world's two greatest minds begins when light yagami finds the death note a notebook with the power to kill and decides to rid the world of criminals
this is england,2006,"Crime, Drama",7.7,a young boy becomes friends with a gang of skinheads friends soon become like family and relationships will be pushed to the very limit,86.0,shanemeadows,thomasturgoose,stephengraham,johartley,this is england crime drama shanemeadows thomasturgoose stephengraham johartley a young boy becomes friends with a gang of skinheads friends soon become like family and relationships will be pushed to the very limit
ex machina,2014,"Drama, Sci-Fi, Thriller",7.7,a young programmer is selected to participate in a ground-breaking experiment in synthetic intelligence by evaluating the human qualities of a highly advanced humanoid ai,78.0,alexgarland,aliciavikander,domhnallgleeson,oscarisaac,ex machina drama sci-fi thriller alexgarland aliciavikander domhnallgleeson oscarisaac a young programmer is selected to participate in a ground-breaking experiment in synthetic intelligence by evaluating the human qualities of a highly advanced humanoid ai
efter brylluppet,2006,Drama,7.7,a manager of an orphanage in india is sent to copenhagen denmark where he discovers a life-altering family secret,78.0,susannebier,madsmikkelsen,sidsebabettknudsen,rolflassgård,efter brylluppet drama susannebier madsmikkelsen sidsebabettknudsen rolflassgård a manager of an orphanage in india is sent to copenhagen denmark where he discovers a life-altering family secret
the last king of scotland,2006,"Biography, Drama, History",7.7,based on the events of the brutal ugandan dictator idi amin's regime as seen by his personal physician during the 1970s,74.0,kevinmacdonald,jamesmcavoy,forestwhitaker,gilliananderson,the last king of scotland biography drama history kevinmacdonald jamesmcavoy forestwhitaker gilliananderson based on the events of the brutal ugandan dictator idi amin's regime as seen by his personal physician during the 1970s
zodiac,2007,"Crime, Drama, Mystery",7.7,in the late 1960s/early 1970s a san francisco cartoonist becomes an amateur detective obsessed with tracking down the zodiac killer an unidentified individual who terrorizes northern california with a killing spree,78.0,davidfincher,jakegyllenhaal,robertdowneyjr,markruffalo,zodiac crime drama mystery davidfincher jakegyllenhaal robertdowneyjr markruffalo in the late 1960s/early 1970s a san francisco cartoonist becomes an amateur detective obsessed with tracking down the zodiac killer an unidentified individual who terrorizes northern california with a killing spree
lucky number slevin,2006,"Action, Crime, Drama",7.7,a case of mistaken identity lands slevin into the middle of a war being plotted by two of the city's most rival crime bosses under constant surveillance by detective brikowski and assassin goodkat he must get them before they get him,53.0,paulmcguigan,joshhartnett,benkingsley,morganfreeman,lucky number slevin action crime drama paulmcguigan joshhartnett benkingsley morganfreeman a case of mistaken identity lands slevin into the middle of a war being plotted by two of the city's most rival crime bosses under constant surveillance by detective brikowski and assassin goodkat he must get them before they get him
joyeux noël,2005,"Drama, History, Music",7.7,in december 1914 an unofficial christmas truce on the western front allows soldiers from opposing sides of the first world war to gain insight into each other's way of life,70.0,christiancarion,dianekruger,bennofürmann,guillaumecanet,joyeux noël drama history music christiancarion dianekruger bennofürmann guillaumecanet in december 1914 an unofficial christmas truce on the western front allows soldiers from opposing sides of the first world war to gain insight into each other's way of life
control,2007,"Biography, Drama, Music",7.7,a profile of ian curtis the enigmatic singer of joy division whose personal professional and romantic troubles led him to commit suicide at the age of 23,78.0,antoncorbijn,samriley,samanthamorton,craigparkinson,control biography drama music antoncorbijn samriley samanthamorton craigparkinson a profile of ian curtis the enigmatic singer of joy division whose personal professional and romantic troubles led him to commit suicide at the age of 23
tangled,2010,"Animation, Adventure, Comedy",7.7,the magically long-haired rapunzel has spent her entire life in a tower but now that a runaway thief has stumbled upon her she is about to discover the world for the first time and who she really is,71.0,nathangreno,byronhoward,mandymoore,zacharylevi,tangled animation adventure comedy nathangreno byronhoward mandymoore zacharylevi the magically long-haired rapunzel has spent her entire life in a tower but now that a runaway thief has stumbled upon her she is about to discover the world for the first time and who she really is
zwartboek,2006,"Drama, Thriller, War",7.7,in the nazi-occupied netherlands during world war ii a jewish singer infiltrates the regional gestapo headquarters for the dutch resistance,71.0,paulverhoeven,caricevanhouten,sebastiankoch,thomhoffman,zwartboek drama thriller war paulverhoeven caricevanhouten sebastiankoch thomhoffman in the nazi-occupied netherlands during world war ii a jewish singer infiltrates the regional gestapo headquarters for the dutch resistance
brokeback mountain,2005,"Drama, Romance",7.7,the story of a forbidden and secretive relationship between two cowboys and their lives over the years,87.0,anglee,jakegyllenhaal,heathledger,michellewilliams,brokeback mountain drama romance anglee jakegyllenhaal heathledger michellewilliams the story of a forbidden and secretive relationship between two cowboys and their lives over the years
3:10 to yuma,2007,"Action, Crime, Drama",7.7,a small-time rancher agrees to hold a captured outlaw who's awaiting a train to go to court in yuma a battle of wills ensues as the outlaw tries to psych out the rancher,76.0,jamesmangold,russellcrowe,christianbale,benfoster,3:10 to yuma action crime drama jamesmangold russellcrowe christianbale benfoster a small-time rancher agrees to hold a captured outlaw who's awaiting a train to go to court in yuma a battle of wills ensues as the outlaw tries to psych out the rancher
crash,2004,"Crime, Drama, Thriller",7.7,los angeles citizens with vastly separate lives collide in interweaving stories of race loss and redemption,66.0,paulhaggis,doncheadle,sandrabullock,thandienewton,crash crime drama thriller paulhaggis doncheadle sandrabullock thandienewton los angeles citizens with vastly separate lives collide in interweaving stories of race loss and redemption
kung fu,2004,"Action, Comedy, Fantasy",7.7,"in shanghai china in the 1940s a wannabe gangster aspires to join the notorious ""axe gang"" while residents of a housing complex exhibit extraordinary powers in defending their turf",78.0,stephenchow,stephenchow,wahyuen,qiuyuen,"kung fu action comedy fantasy stephenchow stephenchow wahyuen qiuyuen in shanghai china in the 1940s a wannabe gangster aspires to join the notorious ""axe gang"" while residents of a housing complex exhibit extraordinary powers in defending their turf"
the bourne supremacy,2004,"Action, Mystery, Thriller",7.7,when jason bourne is framed for a cia operation gone awry he is forced to resume his former life as a trained assassin to survive,73.0,paulgreengrass,mattdamon,frankapotente,joanallen,the bourne supremacy action mystery thriller paulgreengrass mattdamon frankapotente joanallen when jason bourne is framed for a cia operation gone awry he is forced to resume his former life as a trained assassin to survive
the machinist,2004,"Drama, Thriller",7.7,an industrial worker who hasn't slept in a year begins to doubt his own sanity,61.0,bradanderson,christianbale,jenniferjasonleigh,aitanasánchez-gijón,the machinist drama thriller bradanderson christianbale jenniferjasonleigh aitanasánchez-gijón an industrial worker who hasn't slept in a year begins to doubt his own sanity
ray,2004,"Biography, Drama, Music",7.7,the story of the life and career of the legendary rhythm and blues musician ray charles from his humble beginnings in the south where he went blind at age seven to his meteoric rise to stardom during the 1950s and 1960s,73.0,taylorhackford,jamiefoxx,reginaking,kerrywashington,ray biography drama music taylorhackford jamiefoxx reginaking kerrywashington the story of the life and career of the legendary rhythm and blues musician ray charles from his humble beginnings in the south where he went blind at age seven to his meteoric rise to stardom during the 1950s and 1960s
lost in translation,2003,"Comedy, Drama",7.7,a faded movie star and a neglected young woman form an unlikely bond after crossing paths in tokyo,89.0,sofiacoppola,billmurray,scarlettjohansson,giovanniribisi,lost in translation comedy drama sofiacoppola billmurray scarlettjohansson giovanniribisi a faded movie star and a neglected young woman form an unlikely bond after crossing paths in tokyo
harry potter and the goblet of fire,2005,"Adventure, Family, Fantasy",7.7,harry potter finds himself competing in a hazardous tournament between rival schools of magic but he is distracted by recurring nightmares,81.0,mikenewell,danielradcliffe,emmawatson,rupertgrint,harry potter and the goblet of fire adventure family fantasy mikenewell danielradcliffe emmawatson rupertgrint harry potter finds himself competing in a hazardous tournament between rival schools of magic but he is distracted by recurring nightmares
man on fire,2004,"Action, Crime, Drama",7.7,in mexico city a former cia operative swears vengeance on those who committed an unspeakable act against the family he was hired to protect,47.0,tonyscott,denzelwashington,christopherwalken,dakotafanning,man on fire action crime drama tonyscott denzelwashington christopherwalken dakotafanning in mexico city a former cia operative swears vengeance on those who committed an unspeakable act against the family he was hired to protect
coraline,2009,"Animation, Drama, Family",7.7,an adventurous 11-year-old girl finds another world that is a strangely idealized version of her frustrating home but it has sinister secrets,80.0,henryselick,dakotafanning,terihatcher,johnhodgman,coraline animation drama family henryselick dakotafanning terihatcher johnhodgman an adventurous 11-year-old girl finds another world that is a strangely idealized version of her frustrating home but it has sinister secrets
the last samurai,2003,"Action, Drama",7.7,an american military advisor embraces the samurai culture he was hired to destroy after he is captured in battle,55.0,edwardzwick,tomcruise,kenwatanabe,billyconnolly,the last samurai action drama edwardzwick tomcruise kenwatanabe billyconnolly an american military advisor embraces the samurai culture he was hired to destroy after he is captured in battle
the magdalene sisters,2002,Drama,7.7,three young irish women struggle to maintain their spirits while they endure dehumanizing abuse as inmates of a magdalene sisters asylum,83.0,petermullan,eileenwalsh,dorothyduffy,nora-janenoone,the magdalene sisters drama petermullan eileenwalsh dorothyduffy nora-janenoone three young irish women struggle to maintain their spirits while they endure dehumanizing abuse as inmates of a magdalene sisters asylum
good bye lenin!,2003,"Comedy, Drama, Romance",7.7,in 1990 to protect his fragile mother from a fatal shock after a long coma a young man must keep her from learning that her beloved nation of east germany as she knew it has disappeared,68.0,wolfgangbecker,danielbrühl,katrinsaß,chulpankhamatova,good bye lenin! comedy drama romance wolfgangbecker danielbrühl katrinsaß chulpankhamatova in 1990 to protect his fragile mother from a fatal shock after a long coma a young man must keep her from learning that her beloved nation of east germany as she knew it has disappeared
in america,2002,Drama,7.7,a family of irish immigrants adjust to life on the mean streets of hell's kitchen while also grieving the death of a child,76.0,jimsheridan,paddyconsidine,samanthamorton,djimonhounsou,in america drama jimsheridan paddyconsidine samanthamorton djimonhounsou a family of irish immigrants adjust to life on the mean streets of hell's kitchen while also grieving the death of a child
i am sam,2001,Drama,7.7,a mentally handicapped man fights for custody of his 7-year-old daughter and in the process teaches his cold-hearted lawyer the value of love and family,28.0,jessienelson,seanpenn,michellepfeiffer,dakotafanning,i am sam drama jessienelson seanpenn michellepfeiffer dakotafanning a mentally handicapped man fights for custody of his 7-year-old daughter and in the process teaches his cold-hearted lawyer the value of love and family
adaptation.,2002,"Comedy, Drama",7.7,a lovelorn screenwriter becomes desperate as he tries and fails to adapt 'the orchid thief' by susan orlean for the screen,83.0,spikejonze,nicolascage,merylstreep,chriscooper,adaptation comedy drama spikejonze nicolascage merylstreep chriscooper a lovelorn screenwriter becomes desperate as he tries and fails to adapt 'the orchid thief' by susan orlean for the screen
black hawk down,2001,"Drama, History, War",7.7,160 elite us soldiers drop into somalia to capture two top lieutenants of a renegade warlord and find themselves in a desperate battle with a large force of heavily-armed somalis,74.0,ridleyscott,joshhartnett,ewanmcgregor,tomsizemore,black hawk down drama history war ridleyscott joshhartnett ewanmcgregor tomsizemore 160 elite us soldiers drop into somalia to capture two top lieutenants of a renegade warlord and find themselves in a desperate battle with a large force of heavily-armed somalis
road to perdition,2002,"Crime, Drama, Thriller",7.7,a mob enforcer's son witnesses a murder forcing him and his father to take to the road and his father down a path of redemption and revenge,72.0,sammendes,tomhanks,tylerhoechlin,robmaxey,road to perdition crime drama thriller sammendes tomhanks tylerhoechlin robmaxey a mob enforcer's son witnesses a murder forcing him and his father to take to the road and his father down a path of redemption and revenge
