Series_Title,Released_Year,Genre,IMDB_Rating,Overview,Meta_score,Director,Star1,Star2,Star3,soup
gone girl,2014,"Drama, Mystery, Thriller",8.1,with his wife's disappearance having become the focus of an intense media circus a man sees the spotlight turned on him when it's suspected that he may not be innocent,79.0,davidfincher,benaffleck,rosamundpike,neilpatrickharris,gone girl drama mystery thriller davidfincher benaffleck rosamundpike neilpatrickharris with his wife's disappearance having become the focus of an intense media circus a man sees the spotlight turned on him when it's suspected that he may not be innocent
ôkami kodomo no ame to yuki,2012,"Animation, Drama, Fantasy",8.1,after her werewolf lover unexpectedly dies in an accident while hunting for food for their children a young woman must find ways to raise the werewolf son and daughter that she had with him while keeping their trait hidden from society,71.0,mamoruhosoda,aoimiyazaki,takaoosawa,harukuroki,ôkami kodomo no ame to yuki animation drama fantasy mamoruhosoda aoimiyazaki takaoosawa harukuroki after her werewolf lover unexpectedly dies in an accident while hunting for food for their children a young woman must find ways to raise the werewolf son and daughter that she had with him while keeping their trait hidden from society
hacksaw ridge,2016,"Biography, Drama, History",8.1,world war ii american army medic desmond t doss who served during the battle of okinawa refuses to kill people and becomes the first man in american history to receive the medal of honor without firing a shot,71.0,melgibson,andrewgarfield,samworthington,lukebracey,hacksaw ridge biography drama history melgibson andrewgarfield samworthington lukebracey world war ii american army medic desmond t doss who served during the battle of okinawa refuses to kill people and becomes the first man in american history to receive the medal of honor without firing a shot
inside out,2015,"Animation, Adventure, Comedy",8.1,after young riley is uprooted from her midwest life and moved to san francisco her emotions - joy fear anger disgust and sadness - conflict on how best to navigate a new city house and school,94.0,petedocter,ronniedelcarmen,amypoehler,billhader,inside out animation adventure comedy petedocter ronniedelcarmen amypoehler billhader after young riley is uprooted from her midwest life and moved to san francisco her emotions - joy fear anger disgust and sadness - conflict on how best to navigate a new city house and school
barfi!,2012,"Comedy, Drama, Romance",8.1,three young people learn that love can neither be defined nor contained by society's definition of normal and abnormal,78.0,anuragbasu,ranbirkapoor,priyankachopra,ileanad'cruz,barfi! comedy drama romance anuragbasu ranbirkapoor priyankachopra ileanad'cruz three young people learn that love can neither be defined nor contained by society's definition of normal and abnormal
12 years a slave,2013,"Biography, Drama, History",8.1,in the antebellum united states solomon northup a free black man from upstate new york is abducted and sold into slavery,96.0,stevemcqueen,chiwetelejiofor,michaelkennethwilliams,michaelfassbender,12 years a slave biography drama history stevemcqueen chiwetelejiofor michaelkennethwilliams michaelfassbender in the antebellum united states solomon northup a free black man from upstate new york is abducted and sold into slavery
rush,2013,"Action, Biography, Drama",8.1,the merciless 1970s rivalry between formula one rivals james hunt and niki lauda,74.0,ronhoward,danielbrühl,chrishemsworth,oliviawilde,rush action biography drama ronhoward danielbrühl chrishemsworth oliviawilde the merciless 1970s rivalry between formula one rivals james hunt and niki lauda
ford v ferrari,2019,"Action, Biography, Drama",8.1,american car designer carroll shelby and driver ken miles battle corporate interference and the laws of physics to build a revolutionary race car for ford in order to defeat ferrari at the 24 hours of le mans in 1966,81.0,jamesmangold,mattdamon,christianbale,jonbernthal,ford v ferrari action biography drama jamesmangold mattdamon christianbale jonbernthal american car designer carroll shelby and driver ken miles battle corporate interference and the laws of physics to build a revolutionary race car for ford in order to defeat ferrari at the 24 hours of le mans in 1966
spotlight,2015,"Biography, Crime, Drama",8.1,the true story of how the boston globe uncovered the massive scandal of child molestation and cover-up within the local catholic archdiocese shaking the entire catholic church to its core,93.0,tommccarthy,markruffalo,michaelkeaton,rachelmcadams,spotlight biography crime drama tommccarthy markruffalo michaelkeaton rachelmcadams the true story of how the boston globe uncovered the massive scandal of child molestation and cover-up within the local catholic archdiocese shaking the entire catholic church to its core
song of the sea,2014,"Animation, Adventure, Drama",8.1,ben a young irish boy and his little sister saoirse a girl who can turn into a seal go on an adventure to free the fairies and save the spirit world,85.0,tommmoore,davidrawle,brendangleeson,lisahannigan,song of the sea animation adventure drama tommmoore davidrawle brendangleeson lisahannigan ben a young irish boy and his little sister saoirse a girl who can turn into a seal go on an adventure to free the fairies and save the spirit world
kahaani,2012,"Mystery, Thriller",8.1,a pregnant woman's search for her missing husband takes her from london to kolkata but everyone she questions denies having ever met him,78.0,sujoyghosh,vidyabalan,parambratachattopadhyay,indraneilsengupta,kahaani mystery thriller sujoyghosh vidyabalan parambratachattopadhyay indraneilsengupta a pregnant woman's search for her missing husband takes her from london to kolkata but everyone she questions denies having ever met him
zindagi na milegi dobara,2011,"Comedy, Drama",8.1,three friends decide to turn their fantasy vacation into reality after one of their friends gets engaged,78.0,zoyaakhtar,hrithikroshan,farhanakhtar,abhaydeol,zindagi na milegi dobara comedy drama zoyaakhtar hrithikroshan farhanakhtar abhaydeol three friends decide to turn their fantasy vacation into reality after one of their friends gets engaged
prisoners,2013,"Crime, Drama, Mystery",8.1,when keller dover's daughter and her friend go missing he takes matters into his own hands as the police pursue multiple leads and the pressure mounts,70.0,denisvilleneuve,hughjackman,jakegyllenhaal,violadavis,prisoners crime drama mystery denisvilleneuve hughjackman jakegyllenhaal violadavis when keller dover's daughter and her friend go missing he takes matters into his own hands as the police pursue multiple leads and the pressure mounts
mad max: fury road,2015,"Action, Adventure, Sci-Fi",8.1,in a post-apocalyptic wasteland a woman rebels against a tyrannical ruler in search for her homeland with the aid of a group of female prisoners a psychotic worshiper and a drifter named max,90.0,georgemiller,tomhardy,charlizetheron,nicholashoult,mad max: fury road action adventure sci-fi georgemiller tomhardy charlizetheron nicholashoult in a post-apocalyptic wasteland a woman rebels against a tyrannical ruler in search for her homeland with the aid of a group of female prisoners a psychotic worshiper and a drifter named max
a wednesday,2008,"Action, Crime, Drama",8.1,a retiring police officer reminisces about the most astounding day of his career about a case that was never filed but continues to haunt him in his memories - the case of a man and a wednesday,78.0,neerajpandey,anupamkher,naseeruddinshah,jimmysheirgill,a wednesday action crime drama neerajpandey anupamkher naseeruddinshah jimmysheirgill a retiring police officer reminisces about the most astounding day of his career about a case that was never filed but continues to haunt him in his memories - the case of a man and a wednesday
gran torino,2008,Drama,8.1,disgruntled korean war veteran walt kowalski sets out to reform his neighbor thao lor a hmong teenager who tried to steal kowalski's prized possession: a 1972 gran torino,72.0,clinteastwood,clinteastwood,beevang,christophercarley,gran torino drama clinteastwood clinteastwood beevang christophercarley disgruntled korean war veteran walt kowalski sets out to reform his neighbor thao lor a hmong teenager who tried to steal kowalski's prized possession: a 1972 gran torino
harry potter and the deathly hallows: part 2,2011,"Adventure, Drama, Fantasy",8.1,harry ron and hermione search for voldemort's remaining horcruxes in their effort to destroy the dark lord as the final battle rages on at hogwarts,85.0,davidyates,danielradcliffe,emmawatson,rupertgrint,harry potter and the deathly hallows: part 2 adventure drama fantasy davidyates danielradcliffe emmawatson rupertgrint harry ron and hermione search for voldemort's remaining horcruxes in their effort to destroy the dark lord as the final battle rages on at hogwarts
okuribito,2008,"Drama, Music",8.1,a newly unemployed cellist takes a job preparing the dead for funerals,68.0,yôjirôtakita,masahiromotoki,ryôkohirosue,tsutomuyamazaki,okuribito drama music yôjirôtakita masahiromotoki ryôkohirosue tsutomuyamazaki a newly unemployed cellist takes a job preparing the dead for funerals
hachi: a dog's tale,2009,"Biography, Drama, Family",8.1,a college professor bonds with an abandoned dog he takes into his home,78.0,lassehallström,richardgere,joanallen,cary-hiroyukitagawa,hachi: a dog's tale biography drama family lassehallström richardgere joanallen cary-hiroyukitagawa a college professor bonds with an abandoned dog he takes into his home
mary and max,2009,"Animation, Comedy, Drama",8.1,a tale of friendship between two unlikely pen pals: mary a lonely eight-year-old girl living in the suburbs of melbourne and max a forty-four-year old severely obese man living in new york,78.0,adamelliot,tonicollette,philipseymourhoffman,ericbana,mary and max animation comedy drama adamelliot tonicollette philipseymourhoffman ericbana a tale of friendship between two unlikely pen pals: mary a lonely eight-year-old girl living in the suburbs of melbourne and max a forty-four-year old severely obese man living in new york
how to train your dragon,2010,"Animation, Action, Adventure",8.1,a hapless young viking who aspires to hunt dragons becomes the unlikely friend of a young dragon himself and learns there may be more to the creatures than he assumed,75.0,deandeblois,chrissanders,jaybaruchel,gerardbutler,how to train your dragon animation action adventure deandeblois chrissanders jaybaruchel gerardbutler a hapless young viking who aspires to hunt dragons becomes the unlikely friend of a young dragon himself and learns there may be more to the creatures than he assumed
into the wild,2007,"Adventure, Biography, Drama",8.1,after graduating from emory university top student and athlete christopher mccandless abandons his possessions gives his entire $24000 savings account to charity and hitchhikes to alaska to live in the wilderness along the way christopher encounters a series of characters that shape his life,73.0,seanpenn,emilehirsch,vincevaughn,catherinekeener,into the wild adventure biography drama seanpenn emilehirsch vincevaughn catherinekeener after graduating from emory university top student and athlete christopher mccandless abandons his possessions gives his entire $24000 savings account to charity and hitchhikes to alaska to live in the wilderness along the way christopher encounters a series of characters that shape his life
no country for old men,2007,"Crime, Drama, Thriller",8.1,violence and mayhem ensue after a hunter stumbles upon a drug deal gone wrong and more than two million dollars in cash near the rio grande,91.0,ethancoen,joelcoen,tommyleejones,javierbardem,no country for old men crime drama thriller ethancoen joelcoen tommyleejones javierbardem violence and mayhem ensue after a hunter stumbles upon a drug deal gone wrong and more than two million dollars in cash near the rio grande
lage raho munna bhai,2006,"Comedy, Drama, Romance",8.1,munna bhai embarks on a journey with mahatma gandhi in order to fight against a corrupt property dealer,78.0,rajkumarhirani,sanjaydutt,arshadwarsi,vidyabalan,lage raho munna bhai comedy drama romance rajkumarhirani sanjaydutt arshadwarsi vidyabalan munna bhai embarks on a journey with mahatma gandhi in order to fight against a corrupt property dealer
million dollar baby,2004,"Drama, Sport",8.1,a determined woman works with a hardened boxing trainer to become a professional,86.0,clinteastwood,hilaryswank,clinteastwood,morganfreeman,million dollar baby drama sport clinteastwood hilaryswank clinteastwood morganfreeman a determined woman works with a hardened boxing trainer to become a professional
hotel rwanda,2004,"Biography, Drama, History",8.1,paul rusesabagina a hotel manager houses over a thousand tutsi refugees during their struggle against the hutu militia in rwanda africa,79.0,terrygeorge,doncheadle,sophieokonedo,joaquinphoenix,hotel rwanda biography drama history terrygeorge doncheadle sophieokonedo joaquinphoenix paul rusesabagina a hotel manager houses over a thousand tutsi refugees during their struggle against the hutu militia in rwanda africa
taegukgi hwinalrimyeo,2004,"Action, Drama, War",8.1,when two brothers are forced to fight in the korean war the elder decides to take the riskiest missions if it will help shield the younger from battle,64.0,je-kyukang,jangdong-gun,wonbin,eun-julee,taegukgi hwinalrimyeo action drama war je-kyukang jangdong-gun wonbin eun-julee when two brothers are forced to fight in the korean war the elder decides to take the riskiest missions if it will help shield the younger from battle
before sunset,2004,"Drama, Romance",8.1,nine years after jesse and celine first met they encounter each other again on the french leg of jesse's book tour,90.0,richardlinklater,ethanhawke,juliedelpy,vernondobtcheff,before sunset drama romance richardlinklater ethanhawke juliedelpy vernondobtcheff nine years after jesse and celine first met they encounter each other again on the french leg of jesse's book tour
munna bhai m.b.b.s.,2003,"Comedy, Drama, Musical",8.1,a gangster sets out to fulfill his father's dream of becoming a doctor,78.0,rajkumarhirani,sanjaydutt,arshadwarsi,gracysingh,munna bhai mbbs comedy drama musical rajkumarhirani sanjaydutt arshadwarsi gracysingh a gangster sets out to fulfill his father's dream of becoming a doctor
salinui chueok,2003,"Crime, Drama, Mystery",8.1,in a small korean province in 1986 two detectives struggle with the case of multiple young women being found raped and murdered by an unknown culprit,82.0,bongjoonho,kang-hosong,kimsang-kyung,roe-hakim,salinui chueok crime drama mystery bongjoonho kang-hosong kimsang-kyung roe-hakim in a small korean province in 1986 two detectives struggle with the case of multiple young women being found raped and murdered by an unknown culprit
dil chahta hai,2001,"Comedy, Drama, Romance",8.1,three inseparable childhood friends are just out of college nothing comes between them - until they each fall in love and their wildly different approaches to relationships creates tension,78.0,farhanakhtar,aamirkhan,saifalikhan,akshayekhanna,dil chahta hai comedy drama romance farhanakhtar aamirkhan saifalikhan akshayekhanna three inseparable childhood friends are just out of college nothing comes between them - until they each fall in love and their wildly different approaches to relationships creates tension
kill bill: vol. 1,2003,"Action, Crime, Drama",8.1,after awakening from a four-year coma a former assassin wreaks vengeance on the team of assassins who betrayed her,69.0,quentintarantino,umathurman,davidcarradine,darylhannah,kill bill: vol 1 action crime drama quentintarantino umathurman davidcarradine darylhannah after awakening from a four-year coma a former assassin wreaks vengeance on the team of assassins who betrayed her
finding nemo,2003,"Animation, Adventure, Comedy",8.1,after his son is captured in the great barrier reef and taken to sydney a timid clownfish sets out on a journey to bring him home,90.0,andrewstanton,leeunkrich,albertbrooks,ellendegeneres,finding nemo animation adventure comedy andrewstanton leeunkrich albertbrooks ellendegeneres after his son is captured in the great barrier reef and taken to sydney a timid clownfish sets out on a journey to bring him home
catch me if you can,2002,"Biography, Crime, Drama",8.1,barely 21 yet frank is a skilled forger who has passed as a doctor lawyer and pilot fbi agent carl becomes obsessed with tracking down the con man who only revels in the pursuit,75.0,stevenspielberg,leonardodicaprio,tomhanks,christopherwalken,catch me if you can biography crime drama stevenspielberg leonardodicaprio tomhanks christopherwalken barely 21 yet frank is a skilled forger who has passed as a doctor lawyer and pilot fbi agent carl becomes obsessed with tracking down the con man who only revels in the pursuit
amores perros,2000,"Drama, Thriller",8.1,a horrific car accident connects three stories each involving characters dealing with loss regret and life's harsh realities all in the name of love,83.0,alejandrogiñárritu,emilioechevarría,gaelgarcíabernal,goyatoledo,amores perros drama thriller alejandrogiñárritu emilioechevarría gaelgarcíabernal goyatoledo a horrific car accident connects three stories each involving characters dealing with loss regret and life's harsh realities all in the name of love
"monsters, inc.",2001,"Animation, Adventure, Comedy",8.1,in order to power the city monsters have to scare children so that they scream however the children are toxic to the monsters and after a child gets through 2 monsters realize things may not be what they think,79.0,petedocter,davidsilverman,leeunkrich,billycrystal,monsters inc animation adventure comedy petedocter davidsilverman leeunkrich billycrystal in order to power the city monsters have to scare children so that they scream however the children are toxic to the monsters and after a child gets through 2 monsters realize things may not be what they think
"shin seiki evangelion gekijô-ban: air/magokoro wo, kimi ni",1997,"Animation, Action, Drama",8.1,concurrent theatrical ending of the tv series shin seiki evangerion (1995),78.0,hideakianno,kazuyatsurumaki,megumiogata,megumihayashibara,shin seiki evangelion gekijô-ban: air/magokoro wo kimi ni animation action drama hideakianno kazuyatsurumaki megumiogata megumihayashibara concurrent theatrical ending of the tv series shin seiki evangerion (1995)
lagaan: once upon a time in india,2001,"Adventure, Drama, Musical",8.1,the people of a small village in victorian india stake their future on a game of cricket against their ruthless british rulers,84.0,ashutoshgowariker,aamirkhan,raghuviryadav,gracysingh,lagaan: once upon a time in india adventure drama musical ashutoshgowariker aamirkhan raghuviryadav gracysingh the people of a small village in victorian india stake their future on a game of cricket against their ruthless british rulers
the sixth sense,1999,"Drama, Mystery, Thriller",8.1,a boy who communicates with spirits seeks the help of a disheartened child psychologist,64.0,mnightshyamalan,brucewillis,haleyjoelosment,tonicollette,the sixth sense drama mystery thriller mnightshyamalan brucewillis haleyjoelosment tonicollette a boy who communicates with spirits seeks the help of a disheartened child psychologist
la leggenda del pianista sull'oceano,1998,"Drama, Music, Romance",8.1,a baby boy discovered in 1900 on an ocean liner grows into a musical prodigy never setting foot on land,58.0,giuseppetornatore,timroth,pruitttaylorvince,mélaniethierry,la leggenda del pianista sull'oceano drama music romance giuseppetornatore timroth pruitttaylorvince mélaniethierry a baby boy discovered in 1900 on an ocean liner grows into a musical prodigy never setting foot on land
the truman show,1998,"Comedy, Drama",8.1,an insurance salesman discovers his whole life is actually a reality tv show,90.0,peterweir,jimcarrey,edharris,lauralinney,the truman show comedy drama peterweir jimcarrey edharris lauralinney an insurance salesman discovers his whole life is actually a reality tv show
"crna macka, beli macor",1998,"Comedy, Crime, Romance",8.1,matko and his son zare live on the banks of the danube river and get by through hustling and basically doing anything to make a living in order to pay off a business debt matko agrees to marry off zare to the sister of a local gangster,73.0,emirkusturica,bajramseverdzan,srdjan'zika'todorovic,brankakatic,crna macka beli macor comedy crime romance emirkusturica bajramseverdzan srdjan'zika'todorovic brankakatic matko and his son zare live on the banks of the danube river and get by through hustling and basically doing anything to make a living in order to pay off a business debt matko agrees to marry off zare to the sister of a local gangster
the big lebowski,1998,"Comedy, Crime, Sport",8.1,"jeff ""the dude"" lebowski mistaken for a millionaire of the same name seeks restitution for his ruined rug and enlists his bowling buddies to help get it",71.0,joelcoen,ethancoen,jeffbridges,johngoodman,"the big lebowski comedy crime sport joelcoen ethancoen jeffbridges johngoodman jeff ""the dude"" lebowski mistaken for a millionaire of the same name seeks restitution for his ruined rug and enlists his bowling buddies to help get it"
fa yeung nin wah,2000,"Drama, Romance",8.1,two neighbors a woman and a man form a strong bond after both suspect extramarital activities of their spouses however they agree to keep their bond platonic so as not to commit similar wrongs,85.0,kar-waiwong,tonychiu-waileung,maggiecheung,pinglamsiu,fa yeung nin wah drama romance kar-waiwong tonychiu-waileung maggiecheung pinglamsiu two neighbors a woman and a man form a strong bond after both suspect extramarital activities of their spouses however they agree to keep their bond platonic so as not to commit similar wrongs
trainspotting,1996,Drama,8.1,renton deeply immersed in the edinburgh drug scene tries to clean up and get out despite the allure of the drugs and influence of friends,83.0,dannyboyle,ewanmcgregor,ewenbremner,jonnyleemiller,trainspotting drama dannyboyle ewanmcgregor ewenbremner jonnyleemiller renton deeply immersed in the edinburgh drug scene tries to clean up and get out despite the allure of the drugs and influence of friends
fargo,1996,"Crime, Drama, Thriller",8.1,jerry lundegaard's inept crime falls apart due to his and his henchmen's bungling and the persistent police work of the quite pregnant marge gunderson,85.0,joelcoen,ethancoen,williamhmacy,francesmcdormand,fargo crime drama thriller joelcoen ethancoen williamhmacy francesmcdormand jerry lundegaard's inept crime falls apart due to his and his henchmen's bungling and the persistent police work of the quite pregnant marge gunderson
underground,1995,"Comedy, Drama, War",8.1,a group of serbian socialists prepares for the war in a surreal underground filled by parties tragedies love and hate,78.0,emirkusturica,predrag'miki'manojlovic,lazarristovski,mirjanajokovic,underground comedy drama war emirkusturica predrag'miki'manojlovic lazarristovski mirjanajokovic a group of serbian socialists prepares for the war in a surreal underground filled by parties tragedies love and hate
la haine,1995,"Crime, Drama",8.1,24 hours in the lives of three young men in the french suburbs the day after a violent riot,78.0,mathieukassovitz,vincentcassel,hubertkoundé,saïdtaghmaoui,la haine crime drama mathieukassovitz vincentcassel hubertkoundé saïdtaghmaoui 24 hours in the lives of three young men in the french suburbs the day after a violent riot
dilwale dulhania le jayenge,1995,"Drama, Romance",8.1,when raj meets simran in europe it isn't love at first sight but when simran moves to india for an arranged marriage love makes its presence felt,78.0,adityachopra,shahrukhkhan,kajol,amrishpuri,dilwale dulhania le jayenge drama romance adityachopra shahrukhkhan kajol amrishpuri when raj meets simran in europe it isn't love at first sight but when simran moves to india for an arranged marriage love makes its presence felt
before sunrise,1995,"Drama, Romance",8.1,a young man and woman meet on a train in europe and wind up spending one evening together in vienna unfortunately both know that this will probably be their only night together,77.0,richardlinklater,ethanhawke,juliedelpy,andreaeckert,before sunrise drama romance richardlinklater ethanhawke juliedelpy andreaeckert a young man and woman meet on a train in europe and wind up spending one evening together in vienna unfortunately both know that this will probably be their only night together
trois couleurs: rouge,1994,"Drama, Mystery, Romance",8.1,a model discovers a retired judge is keen on invading people's privacy,100.0,krzysztofkieslowski,irènejacob,jean-louistrintignant,frédériquefeder,trois couleurs: rouge drama mystery romance krzysztofkieslowski irènejacob jean-louistrintignant frédériquefeder a model discovers a retired judge is keen on invading people's privacy
chung hing sam lam,1994,"Comedy, Crime, Drama",8.1,two melancholy hong kong policemen fall in love: one with a mysterious female underworld figure the other with a beautiful and ethereal server at a late-night restaurant he frequents,77.0,kar-waiwong,brigittelin,takeshikaneshiro,tonychiu-waileung,chung hing sam lam comedy crime drama kar-waiwong brigittelin takeshikaneshiro tonychiu-waileung two melancholy hong kong policemen fall in love: one with a mysterious female underworld figure the other with a beautiful and ethereal server at a late-night restaurant he frequents
